{
  "$schema": "../../docs/schemas/alcuin-extension.schema.json",
  "manifest_version": "1",
  "id": "ops-toolkit",
  "name": "Operations Toolkit",
  "version": "0.1.0",
  "description": "Read operational records and perform approval-gated ticket updates.",
  "compatibility": ">=0.1.0",
  "contributions": {
    "tools": [
      {
        "name": "ops.search_incidents",
        "description": "Search incident records",
        "input_schema": {
          "type": "object",
          "properties": { "query": { "type": "string" } },
          "required": ["query"]
        },
        "mutating": false
      },
      {
        "name": "ops.update_ticket",
        "description": "Update an incident ticket",
        "input_schema": {
          "type": "object",
          "properties": {
            "ticket_id": { "type": "string" },
            "status": { "type": "string" }
          },
          "required": ["ticket_id", "status"]
        },
        "mutating": true
      }
    ],
    "skills": [{ "id": "incident-brief", "name": "Incident brief" }],
    "agent_templates": [],
    "knowledge_connectors": [],
    "ui_blocks": [
      {
        "id": "active-record",
        "type": "card",
        "title": "Active record",
        "description": "Host context exposed to this Agent session.",
        "source": { "kind": "context", "path": "record" },
        "fields": [
          { "label": "Record", "path": "id", "format": "text" },
          { "label": "Type", "path": "type", "format": "status" }
        ]
      },
      {
        "id": "incident-summary",
        "type": "table",
        "title": "Incident results",
        "description": "Latest structured result from Operations Toolkit.",
        "source": { "kind": "tool_result", "tool": "ops.search_incidents", "path": "incidents" },
        "columns": [
          { "label": "Incident", "path": "id", "format": "text" },
          { "label": "Status", "path": "status", "format": "status" }
        ],
        "empty_state": "Run an incident search to populate this table."
      },
      {
        "id": "update-incident",
        "type": "form",
        "title": "Update incident",
        "description": "Creates an approval-gated Tool Run; submitting never bypasses Agent policy.",
        "fields": [
          {
            "name": "ticket_id",
            "label": "Incident ID",
            "input": "text",
            "required": true,
            "default_path": "record.id"
          },
          {
            "name": "status",
            "label": "New status",
            "input": "select",
            "required": true,
            "options": ["monitoring", "resolved", "open"]
          }
        ],
        "submit": { "tool": "ops.update_ticket", "label": "Request update" }
      }
    ]
  },
  "entrypoints": [{ "type": "builtin", "adapter": "operations-demo" }],
  "config_schema": { "type": "object" },
  "permissions": [
    { "id": "records:read", "reason": "Read operational records", "risk": "low", "required": true },
    { "id": "tickets:write", "reason": "Update incident status", "risk": "high", "required": true }
  ],
  "credential_requirements": []
}
